{
  "$schema": "http://json-schema.org/draft-07/schema#",
  "type": "array",
  "items": {
    "type": "object",
    "required": ["weekStart","weekEnd","titulo"],
    "properties": {
      "weekStart": {"type":"string","pattern":"^\\d{4}-\\d{2}-\\d{2}$"},
      "weekEnd": {"type":"string","pattern":"^\\d{4}-\\d{2}-\\d{2}$"},
      "titulo": {"type":"string"},
      "slug": {"type":"string"},
      "enlace": {"type":"string","format":"uri"}
    },
    "additionalProperties": false
  }
}
